{
  "schema_version": "1.0.0",
  "scheduler_sequence": 7,
  "registry_event_count": 3,
  "generated_at": "2026-06-03T11:01:19Z",
  "assignments": [
    {
      "task_id": "TASK-0001",
      "needed_role": "IMPLEMENTATION",
      "score": 157000,
      "recommended_agent": null,
      "recommended_fit_score": null,
      "fallback_candidates": []
    },
    {
      "task_id": "TASK-0002",
      "needed_role": "IMPLEMENTATION",
      "score": 157000,
      "recommended_agent": null,
      "recommended_fit_score": null,
      "fallback_candidates": []
    },
    {
      "task_id": "TASK-0003",
      "needed_role": "IMPLEMENTATION",
      "score": 157000,
      "recommended_agent": null,
      "recommended_fit_score": null,
      "fallback_candidates": []
    },
    {
      "task_id": "TASK-0004",
      "needed_role": "IMPLEMENTATION",
      "score": 157000,
      "recommended_agent": null,
      "recommended_fit_score": null,
      "fallback_candidates": []
    },
    {
      "task_id": "TASK-0005",
      "needed_role": "IMPLEMENTATION",
      "score": 157000,
      "recommended_agent": null,
      "recommended_fit_score": null,
      "fallback_candidates": []
    },
    {
      "task_id": "TASK-0006",
      "needed_role": "IMPLEMENTATION",
      "score": 157000,
      "recommended_agent": null,
      "recommended_fit_score": null,
      "fallback_candidates": []
    },
    {
      "task_id": "TASK-0007",
      "needed_role": "IMPLEMENTATION",
      "score": 157000,
      "recommended_agent": null,
      "recommended_fit_score": null,
      "fallback_candidates": []
    },
    {
      "task_id": "TASK-0008",
      "needed_role": "IMPLEMENTATION",
      "score": 157000,
      "recommended_agent": null,
      "recommended_fit_score": null,
      "fallback_candidates": []
    },
    {
      "task_id": "TASK-0009",
      "needed_role": "IMPLEMENTATION",
      "score": 157000,
      "recommended_agent": null,
      "recommended_fit_score": null,
      "fallback_candidates": []
    },
    {
      "task_id": "TASK-0010",
      "needed_role": "IMPLEMENTATION",
      "score": 157000,
      "recommended_agent": null,
      "recommended_fit_score": null,
      "fallback_candidates": []
    },
    {
      "task_id": "TASK-0011",
      "needed_role": "IMPLEMENTATION",
      "score": 157000,
      "recommended_agent": null,
      "recommended_fit_score": null,
      "fallback_candidates": []
    },
    {
      "task_id": "TASK-0012",
      "needed_role": "IMPLEMENTATION",
      "score": 157000,
      "recommended_agent": null,
      "recommended_fit_score": null,
      "fallback_candidates": []
    },
    {
      "task_id": "TASK-0013",
      "needed_role": "IMPLEMENTATION",
      "score": 157000,
      "recommended_agent": null,
      "recommended_fit_score": null,
      "fallback_candidates": []
    },
    {
      "task_id": "TASK-0014",
      "needed_role": "IMPLEMENTATION",
      "score": 157000,
      "recommended_agent": null,
      "recommended_fit_score": null,
      "fallback_candidates": []
    },
    {
      "task_id": "TASK-0015",
      "needed_role": "IMPLEMENTATION",
      "score": 157000,
      "recommended_agent": null,
      "recommended_fit_score": null,
      "fallback_candidates": []
    },
    {
      "task_id": "TASK-0016",
      "needed_role": "IMPLEMENTATION",
      "score": 157000,
      "recommended_agent": null,
      "recommended_fit_score": null,
      "fallback_candidates": []
    },
    {
      "task_id": "TASK-0017",
      "needed_role": "IMPLEMENTATION",
      "score": 157000,
      "recommended_agent": null,
      "recommended_fit_score": null,
      "fallback_candidates": []
    },
    {
      "task_id": "TASK-0018",
      "needed_role": "IMPLEMENTATION",
      "score": 157000,
      "recommended_agent": null,
      "recommended_fit_score": null,
      "fallback_candidates": []
    },
    {
      "task_id": "TASK-0019",
      "needed_role": "IMPLEMENTATION",
      "score": 157000,
      "recommended_agent": null,
      "recommended_fit_score": null,
      "fallback_candidates": []
    },
    {
      "task_id": "TASK-0020",
      "needed_role": "IMPLEMENTATION",
      "score": 157000,
      "recommended_agent": null,
      "recommended_fit_score": null,
      "fallback_candidates": []
    },
    {
      "task_id": "TASK-0021",
      "needed_role": "IMPLEMENTATION",
      "score": 157000,
      "recommended_agent": null,
      "recommended_fit_score": null,
      "fallback_candidates": []
    },
    {
      "task_id": "TASK-0022",
      "needed_role": "IMPLEMENTATION",
      "score": 157000,
      "recommended_agent": null,
      "recommended_fit_score": null,
      "fallback_candidates": []
    },
    {
      "task_id": "TASK-0023",
      "needed_role": "IMPLEMENTATION",
      "score": 157000,
      "recommended_agent": null,
      "recommended_fit_score": null,
      "fallback_candidates": []
    },
    {
      "task_id": "TASK-0024",
      "needed_role": "IMPLEMENTATION",
      "score": 157000,
      "recommended_agent": null,
      "recommended_fit_score": null,
      "fallback_candidates": []
    },
    {
      "task_id": "TASK-0025",
      "needed_role": "IMPLEMENTATION",
      "score": 157000,
      "recommended_agent": null,
      "recommended_fit_score": null,
      "fallback_candidates": []
    },
    {
      "task_id": "TASK-0026",
      "needed_role": "IMPLEMENTATION",
      "score": 157000,
      "recommended_agent": null,
      "recommended_fit_score": null,
      "fallback_candidates": []
    },
    {
      "task_id": "TASK-0027",
      "needed_role": "IMPLEMENTATION",
      "score": 157000,
      "recommended_agent": null,
      "recommended_fit_score": null,
      "fallback_candidates": []
    },
    {
      "task_id": "TASK-0028",
      "needed_role": "IMPLEMENTATION",
      "score": 157000,
      "recommended_agent": null,
      "recommended_fit_score": null,
      "fallback_candidates": []
    },
    {
      "task_id": "TASK-0029",
      "needed_role": "IMPLEMENTATION",
      "score": 157000,
      "recommended_agent": null,
      "recommended_fit_score": null,
      "fallback_candidates": []
    },
    {
      "task_id": "TASK-0030",
      "needed_role": "IMPLEMENTATION",
      "score": 157000,
      "recommended_agent": null,
      "recommended_fit_score": null,
      "fallback_candidates": []
    },
    {
      "task_id": "TASK-0031",
      "needed_role": "IMPLEMENTATION",
      "score": 157000,
      "recommended_agent": null,
      "recommended_fit_score": null,
      "fallback_candidates": []
    },
    {
      "task_id": "TASK-0032",
      "needed_role": "IMPLEMENTATION",
      "score": 157000,
      "recommended_agent": null,
      "recommended_fit_score": null,
      "fallback_candidates": []
    },
    {
      "task_id": "TASK-0033",
      "needed_role": "IMPLEMENTATION",
      "score": 157000,
      "recommended_agent": null,
      "recommended_fit_score": null,
      "fallback_candidates": []
    },
    {
      "task_id": "TASK-0034",
      "needed_role": "IMPLEMENTATION",
      "score": 157000,
      "recommended_agent": null,
      "recommended_fit_score": null,
      "fallback_candidates": []
    },
    {
      "task_id": "TASK-0035",
      "needed_role": "IMPLEMENTATION",
      "score": 157000,
      "recommended_agent": null,
      "recommended_fit_score": null,
      "fallback_candidates": []
    },
    {
      "task_id": "TASK-0036",
      "needed_role": "IMPLEMENTATION",
      "score": 157000,
      "recommended_agent": null,
      "recommended_fit_score": null,
      "fallback_candidates": []
    },
    {
      "task_id": "TASK-0037",
      "needed_role": "IMPLEMENTATION",
      "score": 157000,
      "recommended_agent": null,
      "recommended_fit_score": null,
      "fallback_candidates": []
    },
    {
      "task_id": "TASK-0038",
      "needed_role": "IMPLEMENTATION",
      "score": 157000,
      "recommended_agent": null,
      "recommended_fit_score": null,
      "fallback_candidates": []
    },
    {
      "task_id": "TASK-0039",
      "needed_role": "IMPLEMENTATION",
      "score": 157000,
      "recommended_agent": null,
      "recommended_fit_score": null,
      "fallback_candidates": []
    },
    {
      "task_id": "TASK-0040",
      "needed_role": "IMPLEMENTATION",
      "score": 157000,
      "recommended_agent": null,
      "recommended_fit_score": null,
      "fallback_candidates": []
    },
    {
      "task_id": "TASK-0041",
      "needed_role": "IMPLEMENTATION",
      "score": 157000,
      "recommended_agent": null,
      "recommended_fit_score": null,
      "fallback_candidates": []
    },
    {
      "task_id": "TASK-0042",
      "needed_role": "IMPLEMENTATION",
      "score": 157000,
      "recommended_agent": null,
      "recommended_fit_score": null,
      "fallback_candidates": []
    }
  ]
}
